feed_title,entry_title,entry_link,entry_published_date,entry_summary
FOX Sports Digital,"2024-25 NBA championship odds: Celtics, Thunder separating from the pack",https://www.foxsports.com/stories/nba/2024-25-nba-finals-odds-team-futures,"Mon, 04 Nov 2024 11:21:32 -0500",A number of contenders are chasing the defending champion Celtics on the oddsboard. Check out where things stand now that the new NBA season has tipped off.
FOX Sports Digital,2024-25 NBA MVP odds: SGA becomes favorite as Thunder start hot,https://www.foxsports.com/stories/nba/2024-25-nba-mvp-odds-futures,"Mon, 04 Nov 2024 10:50:24 -0500","The Thunder are off to a blazing start, one that has catapulted their superstar into the MVP driver's seat. See the latest."
FOX Sports Digital,"76ers star Joel Embiid verbally confronts, then shoves, Philadelphia reporter",https://www.foxsports.com/stories/nba/76ers-star-joel-embiid-verbally-confronts-shoves-philadelphia-reporter,"Sun, 03 Nov 2024 01:05:30 -0400",A visibly angry Joel Embiid shouted at and eventually shoved a Philadelphia newspaper columnist in a locker room altercation after the struggling 76ers lost to the Memphis Grizzlies on Saturday night
FOX Sports Digital,"NBA considering All-Star Game changes again, away from the 'traditional' format",https://www.foxsports.com/stories/nba/nba-considering-all-star-game-changes-again-away-from-traditional-format,"Sat, 02 Nov 2024 22:45:10 -0400","The NBA is considering changing the format for the All-Star Game that will be played in San Francisco later this season, Commissioner Adam Silver said"
FOX Sports Digital,Toronto Raptors retire Vince Carter's jersey in emotional ceremony,https://www.foxsports.com/stories/nba/toronto-raptors-retire-vince-carters-jersey-emotional-ceremony,"Sat, 02 Nov 2024 22:04:26 -0400",An emotional Vince Carter acknowledged his contentious exit from Toronto as his No. 15 jersey became the first number retired by the Raptors in a halftime ceremony during the team's game against Sacramento
FOX Sports Digital,76ers' Joel Embiid hits back at angry fans: 'I've done way too much for this city',https://www.foxsports.com/stories/nba/76ers-joel-embiid-hits-back-angry-fans-ive-done-way-too-much-city,"Fri, 01 Nov 2024 17:55:14 -0400",Joel Embiid and Paul George will each miss a fifth straight game with left knee injuries when the Philadelphia 76ers host Memphis on Saturday night.
FOX Sports Digital,NBA fines Sixers $100K for 'inconsistent' statements on Joel Embiid's injury status,https://www.foxsports.com/stories/nba/nba-fines-sixers-100k-inconsistent-statements-joel-embiids-injury-status,"Tue, 29 Oct 2024 17:16:31 -0400","The NBA has fined the Philadelphia 76ers $100,000 for making ""inconsistent"" statements about the health of their All-Star center, who has been out with what the team is calling left knee management."
FOX Sports Digital,Dwyane Wade defends his Heat statue: 'It don't need to look like me',https://www.foxsports.com/stories/nba/dwyane-wade-defends-his-heat-statue-it-dont-need-look-like-me,"Tue, 29 Oct 2024 13:13:43 -0400",Dwyane Wade’s new statue celebrates a moment where he won a game with his offense
FOX Sports Digital,"Bronny James expected to begin splitting time between Lakers, G League team after trip",https://www.foxsports.com/stories/nba/bronny-james-expected-begin-splitting-time-between-lakers-g-league-team-after-trip,"Sat, 26 Oct 2024 17:04:36 -0400","Bronny James is expected to begin splitting time between the Lakers and the team’s G League affiliate, even though coach JJ Reddick said those plans could change."
FOX Sports Digital,LeBron and Bronny make history as first father-son duo in the NBA | What's Wright?,https://www.foxsports.com/watch/fmc-77mpov6h84u1edb5,"Sat, 26 Oct 2024 00:38:50 +0000",Nick recaps the Los Angeles Lakers opening night with Bronny and LeBron James playing together.
FOX Sports Digital,"Klay Thompson scores 22 points, breaks franchise 3-point record in Mavs debut",https://www.foxsports.com/stories/nba/klay-thompson-scores-22-points-breaks-record-debut-mavs,"Thu, 24 Oct 2024 22:40:21 -0400","Luka Doncic had 28 points and 10 rebounds, Klay Thompson scored 22 in his Dallas debut, and the Mavericks beat the San Antonio Spurs 120-109 in the opener for both teams."
FOX Sports Digital,"Suns set to contend with Beal, Durant, and Booker, but can Clippers thrive without Kawhi? | Speak",https://www.foxsports.com/watch/fmc-lm0mhot21k5iq7lh,"Thu, 24 Oct 2024 23:39:45 +0000","Paul Pierce evaluates the Phoenix Suns potential as title contenders with stars Bradley Beal, Kevin Durant, and Devin Booker leading the charge. He acknowledges their impressive 45-win season last year, despite being swept in the playoffs. However, Pierce expresses concern over the Los Angeles Clippers ability to compete without Kawhi Leonard."
FOX Sports Digital,NBA is investigating Joel Embiid's playing status after he misses season opener,https://www.foxsports.com/stories/nba/nba-investigating-joel-embiids-playing-status-after-he-misses-season-opener,"Thu, 24 Oct 2024 12:12:18 -0400",The NBA is now investigating why Joel Embiid didn't play in the 76ers' nationally televised season-opener against the Bucks.
FOX Sports Digital,LeBron and Bronny James make history as first father-son duo to play together in the NBA | Speak,https://www.foxsports.com/watch/fmc-aubkt15rtsl0qqhn,"Thu, 24 Oct 2024 01:58:36 +0000","Paul Pierce, Keyshawn Johnson and Joy Taylor share their thoughts on LeBron and Bronny James making history as first father-son duo to play in the NBA."
FOX Sports Digital,"Lakers win season opener vs. T-Wolves, What did opening night tell you? | Speak",https://www.foxsports.com/watch/fmc-h2ad38i9gxjqhcsb,"Thu, 24 Oct 2024 01:56:41 +0000","The Los Angeles Lakers win in season opener. Anthony Davis finished with 36 points and 16 rebounds. Paul Pierce shares his thoughts - ""You have to play through Anthony Davis. He's your best player on both sides of the court."""
FOX Sports Digital,Can Jayson Tatum win MVP and lead the Celtics to a championship? | Speak,https://www.foxsports.com/watch/fmc-ye5fw1bhx5pf2zh5,"Wed, 23 Oct 2024 23:00:28 +0000","Paul Pierce dives into the MVP conversation, asserting that many MVP winners rarely secure a championship in the same year. Despite this, he acknowledges Jayson Tatum's elite status, calling him an MVP-caliber player and possibly the best American-born talent in the NBA today."
FOX Sports Digital,Most 3-Pointers in an NBA Game: Single game records by team and player,https://www.foxsports.com/stories/nba/most-3-pointers-nba-game,"Wed, 23 Oct 2024 16:46:57 -0400",Check out this article for a complete list of teams who have made the most 3-pointers in a single NBA game.
FOX Sports Digital,"Colin's Bold NBA predictions: Lakers miss playoffs, Giannis asks for trade, Luka scores 80 | The Herd",https://www.foxsports.com/watch/fmc-jeplxzknlnyrtzhr,"Wed, 23 Oct 2024 20:06:14 +0000","Colin Cowherd shares his NBA predictions for the 2024-25 season, including the Los Angeles Lakers missing the playoffs, Luka Dončić scoring 80 points in one game and Giannis Antetokounmpo requesting a trade from the Milwaukee Bucks."
